Unnamed: 0,tweet_text,text,text_processed,polarity,sentimen
2158,"Penyesuaian harga BBM, Pemerintah bakal berikan kompensasi dengan Perlinsos - Tutur Jawa Tengah - #BantuanBBMUntukRakyat #BLTBBMTepatSasaran #SubsidiTepatSasaran https://t.co/Ys895kxwwR","adjustments to fuel prices, the government will provide compensation with the Social Security Administration said Central Java","adjustment fuel prices, government provide compensation Social Security Administration said Central Java",0.016666666666666666,positive
2160,Kenaikan BBM masih ada besaran yang ditanggung pemerintah. Sisanya dialihkan untuk bantuan sosial dan BLT. #PertumbuhanEkonomiKuat #IndonesiaBangkit Pancasila #BCAWealthSummit https://t.co/4XXfejSo7d,"the increase in fuel oil is still the amount that is borne by the government, the rest is diverted to social assistance and Pancasila BLT","increase fuel oil still amount borne government, rest diverted social assistance Pancasila BLT",0.03333333333333333,positive
2196,Penyaluran BLT dan BSU bukti pemerintah lindungi masyarakat rentan di tengah penyesuaian harga BBM.  Sumatera Utara  #BLTBBMBantuMasyarakat #BansosBBMRingankanRakyat #KPMPenyaluranBLTTepatSasaran #SukseskanKebijakanPemerintah #SubsidiBerkeadilanUntukMasaDepan,distribution of direct cash assistance and evidence that the government is protecting vulnerable communities amid the North Sumatra fuel price adjustments,distribution direct cash assistance evidence government protecting vulnerable community amid North Sumatra fuel price adjustment,-0.2,negative
2201,Pencairan BLT BBM tahap ke2 akan segera di realisasikan! terimakasih pemerintah!  Jambi  #BLTBBMBantuMasyarakat #BansosBBMRingankanRakyat #KPMPenyaluranBLTTepatSasaran #SukseskanKebijakanPemerintah #SubsidiBerkeadilanUntukMasaDepan https://t.co/xpGo430kWl,"the disbursement of direct fuel oil cash assistance stage to will soon be realized, thanks to the Jambi government","disbursement direct fuel oil cash assistance stage soon realized, thanks Jambi government",0.15000000000000002,positive
2202,"Pemerintah pastikan penyaluran BLT BBM dan BSU tepat sasaran, sehingga membantu masyarakat rentan!  Jambi  #BLTBBMBantuMasyarakat #BansosBBMRingankanRakyat #KPMPenyaluranBLTTepatSasaran #SukseskanKebijakanPemerintah #SubsidiBerkeadilanUntukMasaDepan https://t.co/1aoL9UZBL5",the government ensures that the distribution of direct fuel oil and BSU cash assistance is right on target so that it can help the vulnerable people of Jambi,government ensures distribution direct fuel oil BSU cash assistance right target help vulnerable people Jambi,-0.038095238095238106,negative
2205,"Penyaluran BLT BBM hampir merata, Ayo kita dukung pemerintah dalam penyaluran BLT BBM  Jambi  #BLTBBMBantuMasyarakat #BansosBBMRingankanRakyat #KPMPenyaluranBLTTepatSasaran #SukseskanKebijakanPemerintah #SubsidiBerkeadilanUntukMasaDepan https://t.co/1SsUv9Qhln","the distribution of direct cash assistance from fuel oil is almost evenly distributed, let's support the government in distributing direct cash assistance to fuel oil, Jambi","distribution direct cash assistance fuel oil almost evenly distributed, let's support government distributing direct cash assistance fuel oil, Jambi",0.1,positive
2206,"BLT BBM tahap ke 2 akan segera cair, terimakasih pemerintah!  Jambi  #BLTBBMBantuMasyarakat #BansosBBMRingankanRakyat #KPMPenyaluranBLTTepatSasaran #SukseskanKebijakanPemerintah #SubsidiBerkeadilanUntukMasaDepan https://t.co/67PVqf8AZV","Phase 1 cash assistance for fuel oil will be disbursed soon, thanks to the Jambi government","Phase 1 cash assistance fuel oil disbursed soon, thanks Jambi government",0.2,positive
2210,Kebijakan bantalan sosial BBM bentuk keberpihakan pemerintah pada rakyat #JokowiHebat #JokowiPresidenku #JokowiBapakInfrastruktur #PembangunanUntukRakyat #PresidenJokowi Malut - Maluku Utara https://t.co/Ms3zECXiTP,The fuel oil social bearing policy is a form of the government's alignment with the people of North Maluku,The fuel oil social bearing policy form government's alignment people North Maluku,0.03333333333333333,positive
2211,Pemerintah akan berikan kompensasi akibat penyesuaian harga BBM  Sumatera Utara #BantuanBBMUntukRakyat #BLTBBMTepatSasaran #SubsidiTepatSasaran https://t.co/9a8Z9RYvjU,the government will provide compensation due to the adjustment in the price of fuel oil in North Sumatra,government provide compensation due adjustment price fuel oil North Sumatra,-0.125,negative
2213,Penyaluran BLT bukti pemerintah lindungi masyarakat rentan Daerah Istimewa Yogyakarta BLT BBM Yogyakarta #BLTBBMBantuMasyarakat #BansosBBMRingankanRakyat #KPMPenyaluranBLTTepatSasaran https://t.co/QLILbgkt7S,"the distribution of direct cash assistance is proof that the government protects vulnerable communities in the special region of Yogyakarta, direct cash assistance from fuel oil in Yogyakarta","distribution direct cash assistance proof government protects vulnerable community special region Yogyakarta, direct cash assistance fuel oil Yogyakarta",0.014285714285714284,positive
2214,Pemerintah pastikan BLT BBM tepat sasaran #BLTBBMBantuMasyarakat #BansosBBMRingankanRakyat #KPMPenyaluranBLTTepatSasaran #SukseskanKebijakanPemerintah #SubsidiBerkeadilanUntukMasaDepan https://t.co/rkC7poaUI1,the government ensures that direct fuel oil cash assistance is right on target,government ensures direct fuel oil cash assistance right target,0.19285714285714284,positive
2215,Penyaluran BLT dan BSU bukti pemerintah lindungi masyarakat rentan di tengah penyesuaian harga BBM #BLTBBMBantuMasyarakat #BansosBBMRingankanRakyat #KPMPenyaluranBLTTepatSasaran #SukseskanKebijakanPemerintah #SubsidiBerkeadilanUntukMasaDepan https://t.co/cv5wCZRcRH,distribution of direct cash assistance and evidence that the government is protecting vulnerable communities amidst adjustments in fuel prices,distribution direct cash assistance evidence government protecting vulnerable community amidst adjustment fuel price,-0.2,negative
2219,Pemerintah Pastikan BLT BBM tepat sasaran. Rakyat indonesia dukung bansos BLT BBM karena tepat sasaran.  #BLTBBMBantuMasyarakat #BansosBBMRingankanRakyat #KPMPenyaluranBLTTepatSasaran #SukseskanKebijakanPemerintah #SubsidiBerkeadilanUntukMasaDepan Sumatera Barat https://t.co/MMWgL1OAhP,"the government ensures that direct fuel oil cash assistance is right on target for the people of Indonesia, support social assistance for direct oil fuel cash assistance because it is right on target West Sumatra","government ensures direct fuel oil cash assistance right target people Indonesia, support social assistance direct oil fuel cash assistance right target West Sumatra",0.16095238095238093,positive
2222,Pemerintah peduli rakyat dengan memberikan BLT BBM #BLTBBMBantuMasyarakat #BansosBBMRingankanRakyat #KPMPenyaluranBLTTepatSasaran #SukseskanKebijakanPemerintah #SubsidiBerkeadilanUntukMasaDepan Kepulauan Riau https://t.co/wep5zilV1P,the government cares about the people by providing direct cash assistance to fuel oil in the Riau Islands,government care people providing direct cash assistance fuel oil Riau Islands,0.1,positive
2225,"Terima kasih pemerintah sudah memberikan BLT BBM, cair nih masyarakat senang #BLTBBMBantuMasyarakat #BansosBBMRingankanRakyat #KPMPenyaluranBLTTepatSasaran #SukseskanKebijakanPemerintah #SubsidiBerkeadilanUntukMasaDepan Jawa Barat https://t.co/fGIwh6N2N4","Thank you, the government has provided direct cash assistance with liquid fuel, the people are happy in West Java","Thank you, government provided direct cash assistance liquid fuel, people happy West Java",0.45,positive
2227,Presiden Jokowi Hebat! Bukti komitmen Pemerintah membantu masyarakat kurang mampu melalui BLT BBM  Kepulauan Bangka Belitung  #BLTBBMBantuMasyarakat #BansosBBMRingankanRakyat #KPMPenyaluranBLTTepatSasaran #SukseskanKebijakanPemerintah #SubsidiBerkeadilanUntukMasaDepan https://t.co/uAtaFTuIrA,president jokowi is great proof of the government's commitment to helping underprivileged communities through direct cash assistance from fuel oil in the Bangka Belitung Islands,president jokowi great proof government's commitment helping underprivileged community direct cash assistance fuel oil Bangka Belitung Islands,0.45,positive
2228,Kepedulian Pemerintah kepada masyarakat terlihat melalui BLT BBM Kepulauan Bangka Belitung  #BLTBBMBantuMasyarakat #BansosBBMRingankanRakyat #KPMPenyaluranBLTTepatSasaran #SukseskanKebijakanPemerintah #SubsidiBerkeadilanUntukMasaDepan https://t.co/0MdYtnJMut,the government's concern for the community is seen through direct cash assistance from fuel oil in the Bangka Belitung Islands,government's concern community seen direct cash assistance fuel oil Bangka Belitung Islands,0.1,positive
2231,Nusa Tenggara Timur Inginkan Pemerintah Harus Tetap Kawal Penyaluran BLT BBM Harus Tepat Sasaran  #BLTBBMBantuMasyarakat #BansosBBMRingankanRakyat #KPMPenyaluranBLTTepatSasaran #SukseskanKebijakanPemerintah #SubsidiBerkeadilanUntukMasaDepan https://t.co/5c09owSLrd,East Nusa Tenggara wants the government to continue to oversee the distribution of direct fuel oil cash assistance to be right on target,East Nusa Tenggara want government continue oversee distribution direct fuel oil cash assistance right target,0.19285714285714284,positive
2232,Penyaluran BLT BBM merupakan komitmen Pemerintah untuk menjaga daya beli masyarakat kurang mampu ðª  Kepulauan Bangka Belitung  #BLTBBMBantuMasyarakat #BansosBBMRingankanRakyat #KPMPenyaluranBLTTepatSasaran #SukseskanKebijakanPemerintah #SubsidiBerkeadilanUntukMasaDepan https://t.co/DAd5TdZcKY,distribution of fuel oil direct cash assistance is the government's commitment to maintain the purchasing power of the less fortunate in the Bangka Belitung Islands,distribution fuel oil direct cash assistance government's commitment maintain purchasing power le fortunate Bangka Belitung Islands,0.25,positive
2234,Terima kasih Pemerintah atas penyaluran BLT BBM.Hal ini jadi bukti pemerintah peduli dengan rakyat  Dukung penyaluran BLT #BLTBBMBantuMasyarakat #BansosBBMRingankanRakyat #KPMPenyaluranBLTTepatSasaran #SukseskanKebijakanPemerintah #SubsidiBerkeadilanUntukMasaDepan -Sumatera Utara https://t.co/jFyTL8rzQw,thank you government for distributing direct fuel cash assistance this is proof the government cares about the people supporting the distribution of direct cash assistance north sumatra,thank government distributing direct fuel cash assistance proof government care people supporting distribution direct cash assistance north sumatra,0.15,positive
2235,Kebijakan pemerintah menyalurkan BLT BBM sangat disambut positif oleh masyarakat  Dukung penyaluran BLT #BLTBBMBantuMasyarakat #BansosBBMRingankanRakyat #KPMPenyaluranBLTTepatSasaran #SukseskanKebijakanPemerintah #SubsidiBerkeadilanUntukMasaDepan -Sumatera Utara- https://t.co/oCtFeGqPRg,the government's policy of channeling direct fuel oil cash assistance was welcomed positively by the public. Support the distribution of direct cash assistance in North Sumatra,government's policy channeling direct fuel oil cash assistance welcomed positively public. Support distribution direct cash assistance North Sumatra,0.06666666666666667,positive
2237,Bukti Konkrit pemerintah lindungi masyarakat rentan di Bali dengan penyaluran BLT dan BSU ditengah penyesuaian harga BBM  #BLTBBMBantuMasyarakat #BansosBBMRingankanRakyat #KPMPenyaluranBLTTepatSasaran #SukseskanKebijakanPemerintah #SubsidiBerkeadilanUntukMasaDepan https://t.co/finQ5Nysgv,concrete evidence that the government is protecting vulnerable communities in Bali by distributing direct cash assistance and BSU in the midst of adjusting fuel prices,concrete evidence government protecting vulnerable community Bali distributing direct cash assistance BSU midst adjusting fuel price,-0.08333333333333333,negative
2238,Penyaluran BLT BBM jadi komitmen pemerintah wujudkan penggunaan subsidi tepat sasaran  Dukung penyaluran BLT #BLTBBMBantuMasyarakat #BansosBBMRingankanRakyat #KPMPenyaluranBLTTepatSasaran #SukseskanKebijakanPemerintah #SubsidiBerkeadilanUntukMasaDepan -Sumatera Utara- https://t.co/6NhfXPAiI8,the distribution of direct fuel cash assistance is the government's commitment to realize the use of targeted subsidies to support the distribution of direct cash assistance in North Sumatra,distribution direct fuel cash assistance government's commitment realize use targeted subsidy support distribution direct cash assistance North Sumatra,0.1,positive
2240,Masyarakat sangat berterima kasih kepada pemerintah atas penyaluran BLT BBM ini  Dukung penyaluran BLT #BLTBBMBantuMasyarakat #BansosBBMRingankanRakyat #KPMPenyaluranBLTTepatSasaran #SukseskanKebijakanPemerintah #SubsidiBerkeadilanUntukMasaDepan -Sumatera Utara- https://t.co/oHCCTm7QFH,The community is very grateful to the government for the distribution of direct fuel oil cash assistance to support the distribution of North Sumatra cash direct assistance,The community grateful government distribution direct fuel oil cash assistance support distribution North Sumatra cash direct assistance,0.1,positive
2241,Kebijakan pemerintah mengalihkan subsidi BBM merupakan langkah tepat agar subsidi BBM bisa di nikmati semua kalangan dan tepat sasaran Lampung Dukung Penyesuaian Harga BBM #BantuanBBMUntukRakyat #BLTBBMTepatSasaran #SubsidiTepatSasaran https://t.co/ikGQxsw61M,the government's policy of diverting fuel subsidies is the right step so that fuel subsidies can be enjoyed by all groups and are right on target for Lampung to support fuel price adjustments,government's policy diverting fuel subsidy right step fuel subsidy enjoyed group right target Lampung support fuel price adjustment,0.35714285714285715,positive
2242,"Tinjau penyaluran bantuan pemerintah di Kota Bau-Bau, Presiden Jokowi sampaikan realisasi BSU dan BLT  Jambi dukung BLT BBM   #BLTBBMBantuMasyarakat #BansosBBMRingankanRakyat #KPMPenyaluranBLTTepatSasaran #SukseskanKebijakanPemerintah #SubsidiBerkeadilanUntukMasaDepan https://t.co/q0u8F6agrQ",review the distribution of government assistance in the city of Bau Bau President Jokowi conveys the realization of BSU and direct cash assistance Jambi supports direct fuel oil cash assistance,review distribution government assistance city Bau Bau President Jokowi conveys realization BSU direct cash assistance Jambi support direct fuel oil cash assistance,0.1,positive
2244,Alhamdulillah. Akhirnya pemerintah sudah mulai menyalurkan BLT BBM ke seluruh daerah di Indonesia  Dukung penyaluran BLT #BLTBBMBantuMasyarakat #BansosBBMRingankanRakyat #KPMPenyaluranBLTTepatSasaran #SukseskanKebijakanPemerintah #SubsidiBerkeadilanUntukMasaDepan -Sumatera Utara- https://t.co/x9b3sUEBNf,"thank God, finally the government has started distributing direct fuel oil cash assistance to all regions in Indonesia, support the distribution of direct cash assistance, North Sumatra","thank God, finally government started distributing direct fuel oil cash assistance region Indonesia, support distribution direct cash assistance, North Sumatra",0.06666666666666667,positive
2245,Penyaluran BLT dan BSU bukti pemerintah lindungi masyarakat rentan ditengah penyesuaian harga BBM   Jambi dukung BLT BBM   #BLTBBMBantuMasyarakat #BansosBBMRingankanRakyat #KPMPenyaluranBLTTepatSasaran #SukseskanKebijakanPemerintah #SubsidiBerkeadilanUntukMasaDepan https://t.co/wKeuKrycrL,distribution of direct cash assistance and evidence that the government protects vulnerable communities amid fuel price adjustments Jambi supports direct fuel oil cash assistance,distribution direct cash assistance evidence government protects vulnerable community amid fuel price adjustment Jambi support direct fuel oil cash assistance,-0.10000000000000002,negative
2247,Pemerintah pastikan BLT BBM tahap 2 cair mulai november   Jambi dukung BLT BBM   #BLTBBMBantuMasyarakat #BansosBBMRingankanRakyat #KPMPenyaluranBLTTepatSasaran #SukseskanKebijakanPemerintah #SubsidiBerkeadilanUntukMasaDepan https://t.co/KgChyn8Ulv,the government ensures direct liquid fuel cash assistance starting november Jambi supports direct fuel oil cash assistance,government ensures direct liquid fuel cash assistance starting november Jambi support direct fuel oil cash assistance,0.06666666666666667,positive
2248,"Yuk mari kita dukung penyesuaian BBM oleh pemerintah, demi kebaikan bersama #BantuanBBMUntukRakyat #BLTBBMTepatSasaran #SubsidiTepatSasaran Jawa Barat https://t.co/cam1DtYaLh","Come on, let's support the government's adjustment of fuel oil for the common good of West Java","Come on, let's support government's adjustment fuel oil common good West Java",0.19999999999999998,positive
2249,"Pantau penyaluran BLT, pemerintah pastikan BLT tepat sasaran  Jambi dukung BLT BBM  #BLTBBMBantuMasyarakat #BansosBBMRingankanRakyat #KPMPenyaluranBLTTepatSasaran #SukseskanKebijakanPemerintah #SubsidiBerkeadilanUntukMasaDepan https://t.co/SjrMWiUMdR",monitor the distribution of government blt ensure direct cash assistance is right on target Jambi support direct cash assistance fuel oil,monitor distribution government blt ensure direct cash assistance right target Jambi support direct cash assistance fuel oil,0.16190476190476188,positive
2250,Pemerintah pastikan penyaluran BLT BBM tepat sasaran dan menjangkau masyarakat kecil  Dukung penyaluran BLT #BLTBBMBantuMasyarakat #BansosBBMRingankanRakyat #KPMPenyaluranBLTTepatSasaran #SukseskanKebijakanPemerintah #SubsidiBerkeadilanUntukMasaDepan -Sumatera Utara- https://t.co/kOqH3wI9N5,the government ensures that the distribution of direct fuel oil cash assistance is right on target and reaches small communities. support the distribution of direct cash assistance in North Sumatra,government ensures distribution direct fuel oil cash assistance right target reach small communities. support distribution direct cash assistance North Sumatra,0.05892857142857142,positive
2258,Pemerintah Pastikan penyaluran BLT BBM tepat sasaran. Rakyat indonesia dukung bansos BLT BBM karena tepat sasaran.  #BLTBBMBantuMasyarakat #BansosBBMRingankanRakyat #KPMPenyaluranBLTTepatSasaran #SukseskanKebijakanPemerintah #SubsidiBerkeadilanUntukMasaDepan Sumatera Barat https://t.co/GGON89zWFH,"the government ensures that the distribution of direct fuel oil cash assistance is right on target for the people of Indonesia, support social assistance for direct oil fuel cash assistance because it is right on target for West Sumatra","government ensures distribution direct fuel oil cash assistance right target people Indonesia, support social assistance direct oil fuel cash assistance right target West Sumatra",0.16095238095238093,positive
2259,"Nusa Tenggara Timur Info Bagi Kita Semua BLT BBM Tahap 2 Cair Bulan November , Pemerintah Sayang Masyarakat . #BLTBBMBantuMasyarakat #BansosBBMRingankanRakyat #KPMPenyaluranBLTTepatSasaran #SukseskanKebijakanPemerintah #SubsidiBerkeadilanUntukMasaDepan https://t.co/OGX9IxBj1d",east nusa southeast information for all of us direct cash assistance liquid stage fuel oil in november the government loves the community,east nusa southeast information u direct cash assistance liquid stage fuel oil november government love community,0.3,positive
2263,Kebijakan pemerintah mengalihkan subsidi BBM ke BLT benar-benar sangat membantu perekonomian masyarakat. ðBanten #BLTBBMBantuMasyarakat #BansosBBMRingankanRakyat #KPMPenyaluranBLTTepatSasaran https://t.co/6VBxMXY5nJ,the government's policy of diverting fuel subsidies to direct cash assistance really really helped the economy of the people of Banten,government's policy diverting fuel subsidy direct cash assistance really really helped economy people Banten,0.15000000000000002,positive
2265,Kebijakan Pemerintah sangatlah tepat untuk penyesuaian harga BBM #BantuanBBMUntukRakyat #BLTBBMTepatSasaran #SubsidiTepatSasaran Sumatera Barat https://t.co/exP1RMTNfO,government policy is very appropriate to adjust the price of West Sumatran fuel oil,government policy appropriate adjust price West Sumatran fuel oil,0.5,positive
2268,BLT BBM bentuk kepedulian Pemerintah kepada masyarakat Kepulauan Bangka Belitung  #BLTBBMBantuMasyarakat #BansosBBMRingankanRakyat #KPMPenyaluranBLTTepatSasaran #SukseskanKebijakanPemerintah #SubsidiBerkeadilanUntukMasaDepan https://t.co/eM0ynHv5cD,direct fuel oil cash assistance is a form of government concern for the people of the Bangka Belitung Islands,direct fuel oil cash assistance form government concern people Bangka Belitung Islands,0.1,positive
2270,Semua ekonom setuju kebijakan bantalan sosial BBM bentuk keberpihakan pemerintah pada rakyat   #JokowiHebat #JokowiPresidenku #JokowiBapakInfrastruktur #PembangunanUntukRakyat #PresidenJokowi Jambi Ku https://t.co/5j1pwZ1U1M,All economists agree that the fuel-oil social bearing policy is a form of the government's support for the people of Jambi,All economist agree fuel-oil social bearing policy form government's support people Jambi,0.03333333333333333,positive
2272,Pemerintah Lindungi masyarakat dengan penyaluran BLT BBM. Rakyat indonesia dukung bansos BLT BBM karena tepat sasaran.  #BLTBBMBantuMasyarakat #BansosBBMRingankanRakyat #KPMPenyaluranBLTTepatSasaran #SukseskanKebijakanPemerintah #SubsidiBerkeadilanUntukMasaDepan Sumatera Barat https://t.co/AgEunQxGBk,the government protects the community by distributing direct fuel cash assistance to the people of Indonesia support social assistance direct fuel oil cash assistance because it is right on target West Sumatra,government protects community distributing direct fuel cash assistance people Indonesia support social assistance direct fuel oil cash assistance right target West Sumatra,0.12976190476190474,positive
2277,Pemerintah berkomitmen akan tetap menjaga daya beli masyarakat kurang mampu dengan adanya kebijakan penyesuaian BBM   Kepulauan Bangka Belitung  #BantuanBBMUntukRakyat #BLTBBMTepatSasaran #SubsidiTepatSasaran https://t.co/wA08XnTHQV,the government is committed to maintaining the purchasing power of the less fortunate with the policy of adjusting fuel oil in the Bangka Belitung Islands,government committed maintaining purchasing power le fortunate policy adjusting fuel oil Bangka Belitung Islands,0.4,positive
2278,Presiden jokowi meninjau langsung penyaluran BLT BBM. Kami dukung terus pak program pemerintah Banten #BLTBBMBantuMasyarakat #BansosBBMRingankanRakyat #KPMPenyaluranBLTTepatSasaran #SukseskanKebijakanPemerintah #SubsidiBerkeadilanUntukMasaDepan https://t.co/HWRcw0MpT0,"president jokowi directly inspected the distribution of direct fuel cash assistance, we continue to support the Banten government program sir","president jokowi directly inspected distribution direct fuel cash assistance, continue support Banten government program sir",0.1,positive
2279,"Penyaluran BLT BBM sudah hampir 100 persen, kinerja pemerintah luar biasa bagus Banten #BLTBBMBantuMasyarakat #BansosBBMRingankanRakyat #KPMPenyaluranBLTTepatSasaran #SukseskanKebijakanPemerintah #SubsidiBerkeadilanUntukMasaDepan https://t.co/BcRvGykRSJ",the distribution of direct fuel oil cash assistance is almost a percent of the government's extraordinary performance in Banten,distribution direct fuel oil cash assistance almost percent government's extraordinary performance Banten,0.21666666666666667,positive
2280,Dengan langkah penyesuaian BBM secara tidak langsung Pemerintah telah menyelamatkan hal masyarakat kurang mampu ðª  Kepulauan Bangka Belitung  #BantuanBBMUntukRakyat #BLTBBMTepatSasaran #SubsidiTepatSasaran https://t.co/p0OPJ762CB,"With the step of adjusting fuel oil, the government has indirectly saved the poor people of the Bangka Belitung Islands","With step adjusting fuel oil, government indirectly saved poor people Bangka Belitung Islands",-0.4,negative
2281,Alihsubsidi BBM bentuk pemerintah lebih prioritaskan masyarakat kurang mampu di Bali  #BantuanBBMUntukRakyat #BLTBBMTepatSasaran #SubsidiTepatSasaran https://t.co/OICYZCSSPt,Instead of subsidizing fuel oil in the form of the government prioritizing the poor in Bali,Instead subsidizing fuel oil form government prioritizing poor Bali,-0.4,negative
2282,Kebijakan pemerintah melakukan penyesuaian harga BBM sangat tepat dalam menjaga stabilitas ekonomi indonesia  Dukung penyesuaian harga BBM #BantuanBBMUntukRakyat #BLTBBMTepatSasaran #SubsidiTepatSasaran -Sumatera Utara- https://t.co/O8zY6xQHTb,"the government's policy of adjusting fuel prices is very appropriate in maintaining Indonesia's economic stability, supporting the adjustment of fuel prices in North Sumatra","government's policy adjusting fuel price appropriate maintaining Indonesia's economic stability, supporting adjustment fuel price North Sumatra",0.31666666666666665,positive
2283,Meinjau langsung penyaluran BLT BBM pemerintah turun tangan.. ðBanten #BLTBBMBantuMasyarakat #BansosBBMRingankanRakyat #KPMPenyaluranBLTTepatSasaran #SukseskanKebijakanPemerintah #SubsidiBerkeadilanUntukMasaDepan https://t.co/ORX5E2AJ86,"directly reviewing the distribution of direct fuel oil cash assistance, the government intervened in Banten","directly reviewing distribution direct fuel oil cash assistance, government intervened Banten",0.1,positive
2284,Penyaluran BLT dan BSU bukti pemerintah lindungi masyarakat rentan di tengah penyesuaian harga BBM.  Maluku Utara  #BLTBBMBantuMasyarakat #BansosBBMRingankanRakyat #KPMPenyaluranBLTTepatSasaran #SukseskanKebijakanPemerintah #SubsidiBerkeadilanUntukMasaDepan https://t.co/3UoVWzoqQ9,distribution of direct cash assistance and evidence that the government is protecting vulnerable communities amid fuel price adjustments in North Maluku,distribution direct cash assistance evidence government protecting vulnerable community amid fuel price adjustment North Maluku,-0.2,negative
