Unnamed: 0,tweet_text,text,text_processed,polarity,sentimen
1197,Rakyat bnyk yg sengsara tapi pemerintah masih aja mencekik dgn kenaikan BBM...harga sembako melambung tinggi https://t.co/nDsui7ADob,Many people are miserable but the government is still suffocating with the increase in fuel prices for nine basic commodities soaring,Many people miserable government still suffocating increase fuel price nine basic commodity soaring,-0.25,negative
1201,"Penyaluran BLT BBM langsung oleh bapak Presiden, solusi dari pemerintah mengatasi dampak penyesuaian harga BBM.   #BLTBBMBantuMasyarakat #BansosBBMRingankanRakyat #KPMPenyaluranBLTTepatSasaran #SukseskanKebijakanPemerintah #SubsidiBerkeadilanUntukMasaDepan Bengkulu Camkoha https://t.co/5QJxBBqsNe","the distribution of direct fuel oil cash assistance directly by the president is a solution from the government overcoming the impact of adjusting fuel prices in Bengkulu, Camkoha","distribution direct fuel oil cash assistance directly president solution government overcoming impact adjusting fuel price Bengkulu, Camkoha",0.1,positive
1202,Harga BBM terus disesuaikan dengan bijak oleh pemerintah #BantuanBBMUntukRakyat #BLTBBMTepatSasaran #SubsidiTepatSasaran Kalimantan Timur https://t.co/DJvoreZkzt,the price of fuel oil continues to be adjusted wisely by the east kalimantan government,price fuel oil continues adjusted wisely east kalimantan government,0.7,positive
1204,"Penyaluran BLT BBM langsung oleh bapak Presiden, bukti pemerintah peduli dengan masyarakat  #BLTBBMBantuMasyarakat #BansosBBMRingankanRakyat #KPMPenyaluranBLTTepatSasaran #SukseskanKebijakanPemerintah #SubsidiBerkeadilanUntukMasaDepan Bengkulu Camkoha https://t.co/9H3MsItHJQ","the distribution of direct fuel oil cash assistance directly by the president is proof that the government cares about the people of Bengkulu, Camkoha","distribution direct fuel oil cash assistance directly president proof government care people Bengkulu, Camkoha",0.1,positive
1207,Penyesuaian Harga BBM Bentuk Hadirnya Pemerintah terhadap Masyarakat Menengah Kebawah  #BantuanBBMUntukRakyat #BLTBBMTepatSasaran #SubsidiTepatSasaran BBM Daerah Istimewa Yogyakarta https://t.co/NJkzXM9TJz,the adjustment of fuel prices is the form of the presence of the government towards the middle and lower middle class people of oil fuels in the special region of Yogyakarta,adjustment fuel price form presence government towards middle lower middle class people oil fuel special region Yogyakarta,0.11904761904761905,positive
1214,Penyaluran BLT bukti pemerintah melindungi masyarakat tentang di tengah penyesuaian harga BBM Masyarakat Sulawesi Tengah mendukung kebijakan BLT BBM  #BLTBBMBantuMasyarakat #BansosBBMRingankanRakyat #KPMPenyaluranBLTTepatSasaran #SukseskanKebijakanPemerintah #SubsidiBerkeadila https://t.co/EEo1LKTUtJ,"the distribution of direct cash assistance is evidence that the government is protecting the community amidst the adjustment in the price of fuel oil, the people of Sulawesi are supporting the direct fuel oil cash assistance policy","distribution direct cash assistance evidence government protecting community amidst adjustment price fuel oil, people Sulawesi supporting direct fuel oil cash assistance policy",0.15,positive
1215,Pemerintah harus mengalihkan subsidi BBM agar tepat sasaran https://t.co/dFEzyrEKB4,the government must divert fuel subsidies so that they are right on target,government must divert fuel subsidy right target,0.2857142857142857,positive
1216,Penyaluran BLT bukti pemerintah melindungi masyarakat rentan di tengah penyesuaian harga BBM  Masyarakat Sulawesi Tengah mendukung kebijakan BLT BBM  #BLTBBMBantuMasyarakat #BansosBBMRingankanRakyat #KPMPenyaluranBLTTepatSasaran #SukseskanKebijakanPemerintah #SubsidiBerkeadilanUn https://t.co/javUksY6M3,"the distribution of direct cash assistance is evidence that the government is protecting vulnerable communities in the midst of adjusting fuel prices, the people of Sulawesi are supporting the policy of direct fuel cash assistance","distribution direct cash assistance evidence government protecting vulnerable community midst adjusting fuel prices, people Sulawesi supporting policy direct fuel cash assistance",-0.012500000000000004,negative
1217,Kepulauan Bangka Belitung Urang Melayu Merasa Bangga Dengan Pemerintah Mengeluarkan Subsidi BLT BBM  #BLTBBMBantuMasyarakat #BansosBBMRingankanRakyat #KPMPenyaluranBLTTepatSasaran #SukseskanKebijakanPemerintah #SubsidiBerkeadilanUntukMasaDepan https://t.co/VMMvi9QEdJ,"Bangka Belitung Islands, I am a Malay, I am proud of the government issuing subsidies for fuel oil direct cash assistance","Bangka Belitung Islands, I Malay, I proud government issuing subsidy fuel oil direct cash assistance",0.45,positive
1218,BSU Ringankan Beban Pekerja Saat Harga BBM &amp; Sembako Naik  Di era sekarang adanya kolaborasi yang baik antara sektor swasta dan pemerintah bisa bahu-membahu untuk kesejahteraan pekerja.  https://t.co/RwOzIpbb2q  @jokowi Gas Pol Pemulihan Ekonomi https://t.co/L2t1MtzqCn,bsu lighten the burden on workers when the price of fuel oil & nine basic commodities rises in the current era there is good collaboration between the private sector and the government can work hand in hand for the welfare of gas workers pol economic recovery,bsu lighten burden worker price fuel oil & nine basic commodity rise current era good collaboration private sector government work hand hand welfare gas worker pol economic recovery,0.18,positive
1220,Kepulauan Bangka Belitung Masyarakat Bangga Dengan Pemerintah yang telah mengeluarkan BLT BBM  #BLTBBMBantuMasyarakat #BansosBBMRingankanRakyat #KPMPenyaluranBLTTepatSasaran #SukseskanKebijakanPemerintah #SubsidiBerkeadilanUntukMasaDepan https://t.co/QKXNpbxbJa,the people of the Bangka Belitung Islands are proud of the government which has issued direct fuel oil cash assistance,people Bangka Belitung Islands proud government issued direct fuel oil cash assistance,0.45,positive
1221,"Harga Pertamax Resmi Turun Mulai 1 Oktober, Begini Keputusan Harga Perliternya: Pemerintah resmi menetapkan kebijakan penurunan harga BBM Pertamax mulai hari Sabtu, Tanggal 1 Oktober 2022. https://t.co/mKJyu8qOZz","The first official price drop starting in October, this is the decision per liter price, the government officially stipulates a policy of reducing the price of fuel oil starting on Saturday, October","The first official price drop starting October, decision per liter price, government officially stipulates policy reducing price fuel oil starting Saturday, October",0.08333333333333333,positive
1222,"Kepulauan Bangka Belitung Banyaknya orang kaya yang menyalahgunakan Subsidi BBM, sehingga bantuan Subsidi tidak efektif, pemerintah telah tepat melakukan penyesuaian harga bbm  #BantuanBBMUntukRakyat #BLTBBMTepatSasaran #SubsidiTepatSasaran https://t.co/JQx7WFCe9R","the Bangka Belitung Islands, many rich people abuse fuel subsidies so that subsidy assistance is not effective, the government has made the right adjustments to fuel prices","Bangka Belitung Islands, many rich people abuse fuel subsidy subsidy assistance effective, government made right adjustment fuel price",0.4401785714285714,positive
1224,Sah! Pemerintah Tambah Kuota BBM Pertalite Jadi 29 Juta KL https://t.co/XjRgbZt7kw,the government legally increases the pertalite fuel oil quota to millions if,government legally increase pertalite fuel oil quota million,0.2,positive
1226,"Kepulauan Bangka Belitung Penyesuaian BBM sudah tepat, kami bangga dengan pemerintah  #BantuanBBMUntukRakyat #BLTBBMTepatSasaran #SubsidiTepatSasaran https://t.co/Pes98UkJb4",Bangka Belitung Islands Adjustment of fuel oil is correct. We are proud of the government,Bangka Belitung Islands Adjustment fuel oil correct. We proud government,0.8,positive
1228,"Hai Sobwas Terdepan,  Sebuah keniscayaan bahwa kenaikan harga bahan bakar minyak (BBM) juga diikuti dengan kenaikan harga kebutuhan pokok. Untuk meringankan beban masyarakat, Pemerintah memberikan program bantuan dalam bentuk Bantuan Langsung Tunai Bahan Bahan Minyak (BLT BBM) https://t.co/7ND1xjD0kG","Hi friends, at the forefront of a certainty that the increase in the price of fuel oil will also be followed by an increase in the price of basic needs to ease the burden on the community, the government will provide an assistance program in the form of direct cash assistance for fuel blt fuel","Hi friends, forefront certainty increase price fuel oil also followed increase price basic need ease burden community, government provide assistance program form direct cash assistance fuel blt fuel",0.05,positive
1229,Penyaluran BLT bukti pemerintah melindungi masyarakat rentan di tengah penyesuaian harga BBM #BLTBBMBantuMasyarakat #BansosBBMRingankanRakyat #KPMPenyaluranBLTTepatSasaran #SukseskanKebijakanPemerintah #SubsidiBerkeadilanUntukMasaDepan -Jawa Tengah- https://t.co/KGtvaVZHuj,the distribution of direct cash assistance is evidence that the government is protecting vulnerable communities amid adjustments to fuel prices in Central Java,distribution direct cash assistance evidence government protecting vulnerable community amid adjustment fuel price Central Java,-0.13333333333333333,negative
1230,Pemerintah mengalihkan sebagian subsidi BBM untuk bantuan yang lebih tepat  #BantuanBBMUntukRakyat #BLTBBMTepatSasaran #SubsidiTepatSasaran Kepulauan Riau https://t.co/4hqCsvxApd,the government diverted some fuel subsidies for more appropriate assistance riau islands,government diverted fuel subsidy appropriate assistance riau island,0.5,positive
1231,"Penyesuaian Harga BBM subsidi dilakukan agar subsidi lebih tepat sasaran, serta pemerintah mengeluarkan kebijakan penyaluran bantuan langsung tunai Wonderful bengkulu #BantuanBBMUntukRakyat #BLTBBMTepatSasaran #SubsidiTepatSasaran https://t.co/9nWrQmvPy1",adjustments to the price of subsidized fuel oil were carried out so that the subsidies were more targeted and the government issued a policy for channeling wonderful Bengkulu direct cash assistance,adjustment price subsidized fuel oil carried subsidy targeted government issued policy channeling wonderful Bengkulu direct cash assistance,0.55,positive
1232,Masyarakt diliundung oleh pemerintah lewat BLT BBM #BLTBBMBantuMasyarakat #BansosBBMRingankanRakyat #KPMPenyaluranBLTTepatSasaran #SukseskanKebijakanPemerintah #SubsidiBerkeadilanUntukMasaDepan https://t.co/UfXLI0Phb9,the people are protected by the government through direct cash assistance from fuel oil,people protected government direct cash assistance fuel oil,0.1,positive
1233,Penyaluran BLT BBM bukti pemerintah lindungi masyarakat #BLTBBMBantuMasyarakat #BansosBBMRingankanRakyat #KPMPenyaluranBLTTepatSasaran #SukseskanKebijakanPemerintah #SubsidiBerkeadilanUntukMasaDepan https://t.co/vvtfjS4csv,the distribution of direct fuel oil cash assistance is proof that the government protects the community,distribution direct fuel oil cash assistance proof government protects community,0.1,positive
1235,Langkah bijak pemerintah dalam upaya penyesuaian harga BBM #BantuanBBMUntukRakyat #BLTBBMTepatSasaran #SubsidiTepatSasaran -Jawa Tengah- https://t.co/pyYZF5XydC,the government's wise move in an effort to adjust the price of Central Java fuel oil,government's wise move effort adjust price Central Java fuel oil,0.35,positive
1237,Pengalihan dana subsidi BBM dan penyesuaian harga BBM dilakukan pemerintah untuk bantuan lebih tepat sasaran Wonderful Bengkulu #BantuanBBMUntukRakyat #BLTBBMTepatSasaran #SubsidiTepatSasaran https://t.co/nATDumQQ8O,"the transfer of fuel subsidy funds and adjustments to the price of fuel oil were carried out by the government for more targeted assistance, Wonderful Bengkulu","transfer fuel subsidy fund adjustment price fuel oil carried government targeted assistance, Wonderful Bengkulu",1.0,positive
1238,Pemerintah mengalihkan sebagian subsidi BBM untuk bantuan yang lebih tepat #BantuanBBMUntukRakyat #BLTBBMTepatSasaran #SubsidiTepatSasaran -Jawa Tengah- https://t.co/WjKCLYo6dL,the government diverted some of the fuel subsidies for more appropriate assistance in central java,government diverted fuel subsidy appropriate assistance central java,0.25,positive
1240,Nusa Tenggara Timur Semua pihak dukung penyesalan harga BBM.. Pemerintah peduli rakyat kecilð #BantuanBBMUntukRakyat #BLTBBMTepatSasaran #SubsidiTepatSasaran https://t.co/WjBNQtThJ1,"East Nusa Tenggara, all parties support the regret of fuel prices, the government cares about the common people","East Nusa Tenggara, party support regret fuel prices, government care common people",-0.3,negative
1241,Penyaluran BLT BBM bukti kepedulian pemerintah terhadap masyarakat yang kurang mampu #BLTBBMBantuMasyarakat #BansosBBMRingankanRakyat #KPMPenyaluranBLTTepatSasaran #SukseskanKebijakanPemerintah #SubsidiBerkeadilanUntukMasaDepan https://t.co/7hhGxrDQas,the distribution of direct fuel oil cash assistance is evidence of the government's concern for the less fortunate,distribution direct fuel oil cash assistance evidence government's concern le fortunate,0.25,positive
1242,Penyaluran BLT Bukti Pemerintah Melindungi Masyarakat Rentan di Tengah Penyesuaian Harga BBM  #BLTBBMBantuMasyarakat #BansosBBMRingankanRakyat #KPMPenyaluranBLTTepatSasaran #SukseskanKebijakanPemerintah #SubsidiBerkeadilanUntukMasaDepan Sumatera Selatan https://t.co/GtfkVlE8SB,the distribution of direct cash assistance is evidence that the government is protecting vulnerable communities amid adjustments to the price of fuel oil in South Sumatra,distribution direct cash assistance evidence government protecting vulnerable community amid adjustment price fuel oil South Sumatra,-0.2,negative
1248,"Kunjungan Presiden Jokowi ke Maluku Utara, Terlibat Langsung Dalam Penyaluran BLT BBM Sebagai Bukti Pemerintah Melindungi Masyarakat Rentan di Tengah Penyesuaian Harga BBM. #BLTBBMBantuMasyarakat #BansosBBMRingankanRakyat #KPMPenyaluranBLTTepatSasaran Papua Barat, 3 Oktober 2022 https://t.co/OoxTW4PRge",president jokowi's visit to north moluccas was directly involved in the distribution of direct fuel oil cash assistance as evidence that the government is protecting vulnerable communities amid price adjustments for fuel in west papua october,president jokowi's visit north moluccas directly involved distribution direct fuel oil cash assistance evidence government protecting vulnerable community amid price adjustment fuel west papua october,-0.09999999999999999,negative
1249,"Pemerintah kembali melakukan penyesuaian harga BBM. Setelah sebelumya sempat mengalami kenainan, harga BBM jenis pertamax kini diturunkan.  https://t.co/ylY0yaJ0Rz via @serambinews","The government has again made adjustments to fuel prices after previously having experienced an increase in the price of the first type of fuel oil, now it has been lowered via","The government made adjustment fuel price previously experienced increase price first type fuel oil, lowered via",0.525,positive
1262,Penyaluran BLT bukti Pemerintah melindungi masyarakat rentan di tengah penyesuaian harga BBM - Jawa Tengah Bicara - #BLTBBMBantuMasyarakat #BansosBBMRingankanRakyat #KPMPenyaluranBLTTepatSasaran #SukseskanKebijakanPemerintah #SubsidiBerkeadilanUntukMasaDepan https://t.co/KzZUSwnnHE,the distribution of direct cash assistance is evidence that the government is protecting vulnerable communities amid the price adjustments for fuel oil in Java,distribution direct cash assistance evidence government protecting vulnerable community amid price adjustment fuel oil Java,-0.2,negative
1274,Kunjungan Presiden Jokowi di Maluku Utara. Penyaluran BLT bukti Pemerintah melindungi masyarakat rentan ditengah penyesuaian harga BBM  #BLTBBMBantuMasyarakat #BansosBBMRingankanRakyat #KPMPenyaluranBLTTepatSasaran #SukseskanKebijakanPemerintah #SubsidiBerkeadilanUntukMasaDepan https://t.co/163UIswyo0,"President Joko Widodo's visit to North Maluku, the distribution of direct cash assistance is evidence that the government is protecting vulnerable communities amid adjustments in fuel prices","President Joko Widodo's visit North Maluku, distribution direct cash assistance evidence government protecting vulnerable community amid adjustment fuel price",-0.2,negative
1275,"Penyaluran BLT Bukti Pemerintah Melindungi Masyarakat Rentan Ditengah Penyesuaian Harga BBM, Nusa Tenggara Timur  #BLTBBMBantuMasyarakat #BansosBBMRingankanRakyat #KPMPenyaluranBLTTepatSasaran #SukseskanKebijakanPemerintah #SubsidiBerkeadilanUntukMasaDepan https://t.co/ntXkhbHaRf",the distribution of direct cash assistance is evidence that the government is protecting vulnerable communities amidst the adjustment in fuel prices for East Nusa Tenggara,distribution direct cash assistance evidence government protecting vulnerable community amidst adjustment fuel price East Nusa Tenggara,-0.2,negative
1276,"Penyesuaian harga BBM itu wajar melihat kondisi global, mari terus dukung kebijakan pemerintah #BantuanBBMUntukRakyat #BLTBBMTepatSasaran #SubsidiTepatSasaran https://t.co/yqeWGEMJoU",Adjusting fuel prices is reasonable considering global conditions. Let's continue to support government policies,Adjusting fuel price reasonable considering global conditions. Let's continue support government policy,0.1,positive
1279,Terima kasih pemerintah sudah memberikan BLT BBM untuk masyarakat #BLTBBMBantuMasyarakat #BansosBBMRingankanRakyat #KPMPenyaluranBLTTepatSasaran #SukseskanKebijakanPemerintah #SubsidiBerkeadilanUntukMasaDepan  Jawa Barat https://t.co/bSqUqklkBQ,"Thank you, the government has provided direct fuel oil cash assistance to the people of West Java","Thank you, government provided direct fuel oil cash assistance people West Java",0.1,positive
1280,Penyaluran BLT bukti pemerintah melindungi masyarakat rentan di tengah penyesuaian harga BBM #BLTBBMBantuMasyarakat #BansosBBMRingankanRakyat #KPMPenyaluranBLTTepatSasaran #SukseskanKebijakanPemerintah #SubsidiBerkeadilanUntukMasaDepan  Jawa Barat https://t.co/X7KtVD0SUR,the distribution of direct cash assistance is evidence that the government is protecting vulnerable communities amid adjustments to the price of fuel oil in West Java,distribution direct cash assistance evidence government protecting vulnerable community amid adjustment price fuel oil West Java,-0.2,negative
1284,Mari dukung penyesuaian harga BBM yang merupakan langkah tepat dari pemerintah #BantuanBBMUntukRakyat #BLTBBMTepatSasaran #SubsidiTepatSasaran https://t.co/rKhSrUX8xB,let's support the adjustment of fuel prices which is the right step from the government,let's support adjustment fuel price right step government,0.2857142857142857,positive
1285,Penyesuaian harga BBM oleh pemerintah agar lebih tepat sasaran #BantuanBBMUntukRakyat #BLTBBMTepatSasaran #SubsidiTepatSasaran  Jawa Barat https://t.co/pvjLNBZZxy,adjustment of fuel prices by the government to better target West Java,adjustment fuel price government better target West Java,0.5,positive
1288,Terima kasih pemerintahð BLT BBM lindungi dan ringankan beban kami di warga Nusa Tenggara Timur yang berpenghasilan rendah.  #BLTBBMBantuMasyarakat #BansosBBMRingankanRakyat #KPMPenyaluranBLTTepatSasaran #SukseskanKebijakanPemerintah #SubsidiBerkeadilanUntukMasaDepan https://t.co/U7TEAyCGTS,thank you government direct cash assistance fuel oil protect and lighten our burden on the low-income citizens of East Nusa Tenggara,thank government direct cash assistance fuel oil protect lighten burden low-income citizen East Nusa Tenggara,0.1,positive
1289,BLT BBM adalah bantuan Pemerintah yang dirasakan sangat positif di masyarakat.   Kepulauan Bangka Belitung  #BLTBBMBantuMasyarakat #BansosBBMRingankanRakyat #KPMPenyaluranBLTTepatSasaran #SukseskanKebijakanPemerintah #SubsidiBerkeadilanUntukMasaDepan https://t.co/ozPeUeF28z,direct fuel oil cash assistance is government assistance which is felt very positively in the people of the Bangka Belitung Islands,direct fuel oil cash assistance government assistance felt positively people Bangka Belitung Islands,0.16363636363636364,positive
1290,Rela antri demi mengurangi beban subsidi pemerintah BBM https://t.co/lsdcIAHMTJ,willing to stand in line to reduce the burden of government fuel subsidies,willing stand line reduce burden government fuel subsidy,0.25,positive
1291,Penyaluran BLT bukti pemerintah lindungi masyarakat rentan di tengah penyesuaian harga BBM #BLTBBMBantuMasyarakat #BansosBBMRingankanRakyat #KPMPenyaluranBLTTepatSasaran #SukseskanKebijakanPemerintah #SubsidiBerkeadilanUntukMasaDepan Jawa Barat https://t.co/dxFekYwRfH,the distribution of direct cash assistance is proof that the government is protecting vulnerable communities in the midst of adjusting West Java fuel prices,distribution direct cash assistance proof government protecting vulnerable community midst adjusting West Java fuel price,-0.2,negative
1293,Pemerintah melalui Kemenkeu memastikan tidak ada BLT BBM yang akan disalurkan pada bulan Oktober. Pencairan BLT BBM tahap 2 baru akan disalurkan pada November tujuan dari penyaluran BLT BBM utk meringankan beban ekonomi dan menjaga daya beli rumah tangga miskin dan rentan. https://t.co/u5pjoa4PzL,The government through the Ministry of Finance ensures that there is no direct fuel oil cash assistance that will be distributed in October. The disbursement of the new phase of fuel oil cash assistance will be distributed in November. poor and vulnerable,The government Ministry Finance ensures direct fuel oil cash assistance distributed October. The disbursement new phase fuel oil cash assistance distributed November. poor vulnerable,-0.16590909090909092,negative
1294,"Untuk meningkatkan daya beli masyarakat, pemerintah mengalihkan subsidi BBM menjadi dana bantuan sosial (bansos). #SubsidiBBMTepatSasaran https://t.co/gn9VtlUjII","to increase people's purchasing power, the government diverted fuel subsidies into social assistance funds for social assistance","increase people's purchasing power, government diverted fuel subsidy social assistance fund social assistance",0.03333333333333333,positive
1296,Kebijakan penyesuaian Harga BBM Untuk Kepentingan Bersama dan lebih tepat sasaran Penyesuaian Harga BBM Langkah Tepat pemerintah Ikatan Pemuda Nusa Tenggara Barat Untuk Kesejahteraan Indonesia #BantuanBBMUntukRakyat #BLTBBMTepatSasaran #SubsidiTepatSasaran https://t.co/jKfD5dtRKi,the policy of adjusting the price of fuel oil for the common good and more targeted adjustment of the price of fuel oil is the right step for the government of the West Nusa Tenggara Youth Association for the welfare of Indonesia,policy adjusting price fuel oil common good targeted adjustment price fuel oil right step government West Nusa Tenggara Youth Association welfare Indonesia,0.22857142857142856,positive
1298,Penyesuaian Harga BBM Langkah Tepat pemerintah Ikatan Pemuda Nusa Tenggara Barat Untuk Kesejahteraan Indonesia #BantuanBBMUntukRakyat #BLTBBMTepatSasaran #SubsidiTepatSasaran https://t.co/wq0RpLxwNq,Adjusting the price of fuel oil is the right step for the West Nusa Tenggara Youth Association government for the welfare of Indonesia,Adjusting price fuel oil right step West Nusa Tenggara Youth Association government welfare Indonesia,0.2857142857142857,positive
1302,"BLT BBM melindungi rakyat dari gejolak harga global, masyarakat Jawa Timur sangat berterima kasih kepada pemerintah #BLTBBMBantuMasyarakat #BansosBBMRingankanRakyat #KPMPenyaluranBLTTepatSasaran #SukseskanKebijakanPemerintah #SubsidiBerkeadilanUntukMasaDepan https://t.co/sAtEqYVJXV",Direct cash assistance from fuel oil protects the people from global price fluctuations. The people of East Java are very grateful to the government,Direct cash assistance fuel oil protects people global price fluctuations. The people East Java grateful government,0.05,positive
1304,Pemerintah berkomitmen untuk menjaga saya beli masyarkat kurang mampu melalui penyaluran BLT BBM  Kepulauan Bangka Belitung  #BLTBBMBantuMasyarakat #BansosBBMRingankanRakyat #KPMPenyaluranBLTTepatSasaran #SukseskanKebijakanPemerintah #SubsidiBerkeadilanUntukMasaDepan https://t.co/KzYrll5evN,the government is committed to keeping me from buying less fortunate people through the distribution of direct cash assistance from fuel oil in the Bangka Belitung Islands,government committed keeping buying le fortunate people distribution direct cash assistance fuel oil Bangka Belitung Islands,0.25,positive
1305,"Pemerintah Gelontorkan Bansos Rp 24,17 Triliun, Sinyal Harga BBM Naik Makin Kuat? https://t.co/BHnaPQ5F2O","The government dispenses IDR trillion in social assistance, a signal that the price of fuel oil is getting stronger","The government dispenses IDR trillion social assistance, signal price fuel oil getting stronger",0.03333333333333333,positive
1306,Adanya tambahan dana dari penyesuaian harga BBM akan digunakan pemerintah untuk pembangunan infrastruktur dan peningkatan kesejahteraan rakyat kecil.  #BantuanBBMUntukRakyat #BLTBBMTepatSasaran #SubsidiTepatSasaran  Sulawesi Tenggara https://t.co/ZSQPZLNFIl,the additional funds from the adjustment of fuel prices will be used by the government for infrastructure development and improving the welfare of the small people of Southeast Sulawesi,additional fund adjustment fuel price used government infrastructure development improving welfare small people Southeast Sulawesi,-0.25,negative
1307,Pemerintah terus cairkan BLT BBM untuk rakyat Kepulauan Bangka Belitung  #BLTBBMBantuMasyarakat #BansosBBMRingankanRakyat #KPMPenyaluranBLTTepatSasaran #SukseskanKebijakanPemerintah #SubsidiBerkeadilanUntukMasaDepan https://t.co/IGIbUaAmj2,the government continues to disburse fuel oil direct cash assistance to the people of the Bangka Belitung Islands,government continues disburse fuel oil direct cash assistance people Bangka Belitung Islands,0.1,positive
