Unnamed: 0,tweet_text,text,text_processed,polarity,sentimen
3073,Penyesuaian harga BBM harus diambil pemerintah agar menahan inflasi yang dampak biayanya jauh lebih besar  Gorontalo #BantuanBBMUntukRakyat #BLTBBMTepatSasaran #SubsidiTepatSasaran https://t.co/LdGWntJtpS,"the government must make adjustments to the price of fuel oil in order to contain inflation, which has a much greater cost impact in Gorontalo","government must make adjustment price fuel oil order contain inflation, much greater cost impact Gorontalo",0.5,positive
3076,"Pemerintah mampu jaga ekonomi di tengah penyesuaian harga BBM, masyarakat Banten mendukung.  #BantuanBBMUntukRakyat #BLTBBMTepatSasaran #SubsidiTepatSasaran https://t.co/oS6bgInhwG",The government is able to maintain the economy amidst the fuel price adjustments for the people of Banten,The government able maintain economy amidst fuel price adjustment people Banten,0.5,positive
3080,Pemerintah mampu jaga ekonomi di tengah penyesuaian harga BBM  #BantuanBBMUntukRakyat #BLTBBMTepatSasaran #SubsidiTepatSasaran Sumatera Selatan https://t.co/7M6mlwDfrC,the government was able to maintain the economy amid adjustments to fuel prices for South Sumatra,government able maintain economy amid adjustment fuel price South Sumatra,0.5,positive
3081,Penyesesuaim harga BBM harus di ambil pemerintah agar menahan inflasi yang dampak biayanya jauh lebih besar.   Gorontalo #BantuanBBMUntukRakyat #BLTBBMTepatSasaran #SubsidiTepatSasaran https://t.co/KKvGgswOxA,"The government must take adjustments to the price of fuel oil in order to contain inflation, which has a far greater cost in Gorontalo","The government must take adjustment price fuel oil order contain inflation, far greater cost Gorontalo",0.3,positive
3082,Pemerintah mampu menjaga ekonomi di tengah penyesuaian harga BBM. Suara Aceh #BantuanBBMUntukRakyat #BLTBBMTepatSasaran #SubsidiTepatSasaran https://t.co/JZo93vCSrM,the government was able to maintain the economy amid the price adjustments for Aceh's sound fuel,government able maintain economy amid price adjustment Aceh's sound fuel,0.45,positive
3083,"Pengalihan subsidi BBM ke sektor yang lebih bermanfaat adalah langkah yang hebat yang di ambil oleh pemerintah,  Banten mendukung.  #BantuanBBMUntukRakyat #BLTBBMTepatSasaran #SubsidiTepatSasaran https://t.co/kdrYROwgdS",The transfer of fuel subsidies to sectors that are more beneficial is a great step taken by the Banten government,The transfer fuel subsidy sector beneficial great step taken Banten government,0.8,positive
3086,Kepulauan Bangka Belitung  Pemerintah sudah menyakurkan BLT BBM kepada 19 juta masyarakat Indonesia. Terimakasih Pak Jokowi #BLTBBMBantuMasyarakat #BansosBBMRingankanRakyat #KPMPenyaluranBLTTepatSasaran #SukseskanKebijakanPemerintah #SubsidiBerkeadilanUntukMasaDepan https://t.co/fiNilNpV9x,"the Bangka Belitung Islands, the government has provided direct cash assistance for fuel oil to millions of Indonesian people, thank you Pak Jokowi","Bangka Belitung Islands, government provided direct cash assistance fuel oil million Indonesian people, thank Pak Jokowi",0.1,positive
3087,Pilihan pemerintah untuk menyesuaikan harga BBM dinilai baik di mata masyarakat Banten.  #BantuanBBMUntukRakyat #BLTBBMTepatSasaran #SubsidiTepatSasaran https://t.co/vf8ZYtMeNw,the government's choice to adjust the price of fuel oil is considered good in the eyes of the people of Banten,government's choice adjust price fuel oil considered good eye people Banten,0.7,positive
3089,Pemerintah mampu jaga ekonomi ditengah penyesuaian harga BBM   Jambi dukung penyesuaian harga BBM   #BantuanBBMUntukRakyat #BLTBBMTepatSasaran #SubsidiTepatSasaran https://t.co/jke4tP4044,the government is able to maintain the economy amid the adjustment in the price of fuel oil Jambi supports the adjustment in the price of fuel oil,government able maintain economy amid adjustment price fuel oil Jambi support adjustment price fuel oil,0.5,positive
3090,Penyesuain harga BBM harus diambil pemerintah agar menahan inflasi yang dampak biayanya jauh lebih besar #BantuanBBMUntukRakyat #BLTBBMTepatSasaran #SubsidiTepatSasaran Jawa Barat https://t.co/YM7DhwhpZG,The government must make adjustments to the price of fuel oil in order to contain inflation which has a far greater cost impact in West Java,The government must make adjustment price fuel oil order contain inflation far greater cost impact West Java,0.3,positive
3095,penyesuaian harga BBM harus diambil pemerintah agar menahan inflasi yang dampak biayanya jauh lebih besar  #BantuanBBMUntukRakyat #BLTBBMTepatSasaran #SubsidiTepatSasaran https://t.co/oJoE0Q4xYT,"the government must make adjustments to the price of fuel oil in order to contain inflation, which has a far greater cost impact","government must make adjustment price fuel oil order contain inflation, far greater cost impact",0.3,positive
3096,pemerintah mampu jaga ekonomi di tengah penyesuaian harga BBM   #BantuanBBMUntukRakyat #BLTBBMTepatSasaran #SubsidiTepatSasaran https://t.co/hmRmfZePvb,the government was able to maintain the economy amidst adjustments in fuel prices,government able maintain economy amidst adjustment fuel price,0.5,positive
3098,Pemerintah mampu jaga ekonomi ditengah penyesuaian Harga BBM. Jambi #BantuanBBMUntukRakyat #BLTBBMTepatSasaran #SubsidiTepatSasaran https://t.co/SWnylmIIK0,the government is able to maintain the economy amid the adjustment of Jambi fuel prices,government able maintain economy amid adjustment Jambi fuel price,0.5,positive
3099,Roda perputaran ekonomi akan semakin kencang berputar karena melalui subsidi penyesuaian BBM Pemerintah memberikan bantuan kepada masyarakat kurang mampu dan UMKM  Kepulauan Bangka Belitung  #BantuanBBMUntukRakyat #BLTBBMTepatSasaran #SubsidiTepatSasaran https://t.co/eTEHVmANVi,the wheel of economic rotation will spin even faster because through fuel adjustment subsidies the government provides assistance to the underprivileged and small and medium enterprises of the Bangka Belitung Islands,wheel economic rotation spin even faster fuel adjustment subsidy government provides assistance underprivileged small medium enterprise Bangka Belitung Islands,-0.024999999999999994,negative
3101,Penyesuaian Harga BBM harus dia. Nil pemerintah agar menahan inflasiyang dampak biayanya jauh lebih besar. Jambi #BantuanBBMUntukRakyat #BLTBBMTepatSasaran #SubsidiTepatSasaran https://t.co/bIY5ONOxDj,adjustments in the price of fuel oil must be provided by the government in order to contain inflation whose cost impact is far greater in Jambi,adjustment price fuel oil must provided government order contain inflation whose cost impact far greater Jambi,0.3,positive
3102,"Subsidi dari penyesuaian BBM telah dialihkan Pemerintah kepada sektor masyarakat kurang mampu, pendidikan dan kesehatan  Kepulauan Bangka Belitung  #BantuanBBMUntukRakyat #BLTBBMTepatSasaran #SubsidiTepatSasaran https://t.co/T22DYymqGs",subsidies from adjustments to fuel oil have been transferred by the government to the education and health sectors of the less fortunate in the Bangka Belitung Islands,subsidy adjustment fuel oil transferred government education health sector le fortunate Bangka Belitung Islands,0.4,positive
3103,Pemerintah mampu jaga ekonomi di tengah penyesuaian harga BBM  Sumatera Utara #BantuanBBMUntukRakyat #BLTBBMTepatSasaran #SubsidiTepatSasaran https://t.co/2v4Y7CILwu,the government was able to maintain the economy amid adjustments to fuel prices for North Sumatra,government able maintain economy amid adjustment fuel price North Sumatra,0.5,positive
3104,Pemerintah mampu menjaga ekonomi di tengah penyesuaian harga BBM. Rakyat indonesia dukung Penyesuaian Harga BBM.   #BantuanBBMUntukRakyat #BLTBBMTepatSasaran #SubsidiTepatSasaran Sumatera Barat https://t.co/zKZFcD3GWk,"The government is able to maintain the economy amidst the adjustment in fuel prices, the people of Indonesia support the adjustment in West Sumatra's fuel prices","The government able maintain economy amidst adjustment fuel prices, people Indonesia support adjustment West Sumatra's fuel price",0.5,positive
3106,Pemerintah terus menyalurkan bantuan BLT BBM. bali  #BLTBBMBantuMasyarakat #BansosBBMRingankanRakyat #KPMPenyaluranBLTTepatSasaran #SukseskanKebijakanPemerintah #SubsidiBerkeadilanUntukMasaDepan https://t.co/ngWObuVAno,the government continues to distribute direct cash assistance for bali fuel,government continues distribute direct cash assistance bali fuel,0.1,positive
3107,Jutaan orang sudah menerima BLT BBM dari pemerintah. Bali  #BLTBBMBantuMasyarakat #BansosBBMRingankanRakyat #KPMPenyaluranBLTTepatSasaran #SukseskanKebijakanPemerintah #SubsidiBerkeadilanUntukMasaDepan https://t.co/LiQk0RxEZw,Millions of people have received direct cash assistance from fuel oil from the Bali government,Millions people received direct cash assistance fuel oil Bali government,0.1,positive
3108,Pemerintah mampu jaga ekonomi ditengah penyesuaian harga BBM ððð  #BantuanBBMUntukRakyat #BLTBBMTepatSasaran #SubsidiTepatSasaran Jawa Barat https://t.co/xpQHnSeFeR,the government is able to maintain the economy amid adjustments to the price of West Java fuel oil,government able maintain economy amid adjustment price West Java fuel oil,0.5,positive
3110,Pemerintah mempercepat penyaluran BLT BBM kepada masyarakat bali  #BLTBBMBantuMasyarakat #BansosBBMRingankanRakyat #KPMPenyaluranBLTTepatSasaran #SukseskanKebijakanPemerintah #SubsidiBerkeadilanUntukMasaDepan https://t.co/BfZw3cOeZa,the government accelerates the distribution of fuel oil cash direct assistance to the people of Bali,government accelerates distribution fuel oil cash direct assistance people Bali,0.1,positive
3111,BLT BBM untuk membantu masyarakat Masyarakat Kepulauan Riau apresiasi pemerintah #BantuanBBMUntukRakyat #BLTBBMTepatSasaran #SubsidiTepatSasaran https://t.co/3WwBf5GfWx,direct fuel oil cash assistance to help the people of the Riau Islands government appreciation,direct fuel oil cash assistance help people Riau Islands government appreciation,0.1,positive
3112,Pemerintah sudah mulai menyalurkan BLT BBM kepada seluruh masyarakat Indonesia. Masyarakat semakin sejahtera  #BLTBBMBantuMasyarakat #BansosBBMRingankanRakyat #KPMPenyaluranBLTTepatSasaran #SukseskanKebijakanPemerintah #SubsidiBerkeadilanUntukMasaDepan -Sumatera Utara- https://t.co/M0gNj9sJng,"The government has started distributing direct fuel oil cash assistance to all Indonesian people, the people of North Sumatra are increasingly prosperous","The government started distributing direct fuel oil cash assistance Indonesian people, people North Sumatra increasingly prosperous",0.1,positive
3113,"Dukung pemerintah mengalihkan subsidi BBM untuk mewujudkan asas keadilan, jangan sampai subsidi untuk rakyat kecil dinikmati orang kaya. Kebijakan Pemerintah Sudah Tepat  Sumatera Utara  #BantuanBBMUntukRakyat #BLTBBMTepatSasaran #SubsidiTepatSasaran https://t.co/C6YxCB0dVW","support the government diverting fuel subsidies to realize the principle of justice, don't let the subsidies for the common people benefit the rich, the government's policy is right, North Sumatra","support government diverting fuel subsidy realize principle justice, let subsidy common people benefit rich, government's policy right, North Sumatra",0.12023809523809524,positive
3114,Pemerintah mampu jaga ekonomi di tengah penyesuaian Harga BBM #BantuanBBMUntukRakyat #BLTBBMTepatSasaran #SubsidiTepatSasaran Aceh https://t.co/JvOs7A2aVX,the government is able to maintain the economy amid the price adjustment of aceh fuel oil,government able maintain economy amid price adjustment aceh fuel oil,0.5,positive
3119,Sudah tepat Harga BBM subsidi perlu penyesuaian. Kebijakan Pemerintah Sudah Tepat  Sumatera Utara  #BantuanBBMUntukRakyat #BLTBBMTepatSasaran #SubsidiTepatSasaran https://t.co/qI4eB0R9L2,"the price of subsidized fuel oil is right, it needs to adjust government policies, it is right, North Sumatra","price subsidized fuel oil right, need adjust government policies, right, North Sumatra",0.2857142857142857,positive
3121,Kepulauan Bangka Belitung  Pemerintah masih tetap bisa menjaga ekonomi walaupun dilakukan penyesuaian harga BBM #BantuanBBMUntukRakyat #BLTBBMTepatSasaran #SubsidiTepatSasaran https://t.co/DVGBRAWfMQ,"Bangka Belitung Islands, the government is still able to maintain the economy despite adjustments to fuel prices","Bangka Belitung Islands, government still able maintain economy despite adjustment fuel price",0.5,positive
3123,Kita harus peduli dengan kondisi perkembangan dinamika harga minyak dunia. Wajar jika penyesuaian harga BBM dilakukan pemerintah. Seluruh masyarakat  sumatera utara dukung kenaikan harga BBM #BantuanBBMUntukRakyat #BLTBBMTepatSasaran #SubsidiTepatSasaran https://t.co/Ajw7IyJxJh,We must be concerned with the development of the dynamics of world oil prices. It is only natural that the government of the whole community of North Sumatra will support the increase in fuel prices.,We must concerned development dynamic world oil prices. It natural government whole community North Sumatra support increase fuel prices.,0.10000000000000002,positive
3124,Penyesuaian harga BBM harus di ambil pemerintah agar menahan inflasi yang dampak biasanya jauh lebih besar  #BantuanBBMUntukRakyat #BLTBBMTepatSasaran #SubsidiTepatSasaran Kepulauan Riau https://t.co/gBUBaglIq8,"the government must make adjustments to the price of fuel oil in order to contain inflation, the impact of which is usually far greater in the Riau Islands","government must make adjustment price fuel oil order contain inflation, impact usually far greater Riau Islands",0.3,positive
3125,Pemerintah mampu jaga ekonomi di tengah penyesuaian harga BBM #BantuanBBMUntukRakyat #BLTBBMTepatSasaran #SubsidiTepatSasaran Kepulauan Riau https://t.co/eslgN4iCz7,the government was able to maintain the economy amidst the price adjustments for fuel oil in the Riau Islands,government able maintain economy amidst price adjustment fuel oil Riau Islands,0.5,positive
3126,Pemerintah mampu jaga ekonomi di tengah penyesuaian harga BBM. Bali  #BantuanBBMUntukRakyat #BLTBBMTepatSasaran #SubsidiTepatSasaran https://t.co/f9vAke7v2K,the government is able to maintain the economy amid adjustments to Bali fuel prices,government able maintain economy amid adjustment Bali fuel price,0.5,positive
3127,Kebijakan pemerintah demi kebaikan bersama. Ayo dukung penyesuaian harga BBM.   #BantuanBBMUntukRakyat #BLTBBMTepatSasaran #SubsidiTepatSasaran https://t.co/MDwDYWUOz5,government policy for the common good let's support the adjustment of fuel prices,government policy common good let's support adjustment fuel price,0.19999999999999998,positive
3130,Pengamat publik yakin Pemerintah mampu jaga perputaran roda ekonomi rakyat pasca penetapan kebijakan penyesuaian harga BBM ð   #BantuanBBMUntukRakyat #BLTBBMTepatSasaran #SubsidiTepatSasaran Berita Jambi https://t.co/E3YTlnulBL,"public observers believe that the government is able to keep the wheels of the people's economy spinning after the establishment of the fuel price adjustment policy, Jambi news","public observer believe government able keep wheel people's economy spinning establishment fuel price adjustment policy, Jambi news",0.25,positive
3135,Ayo dukung penyesuaian harga BBM oleh pemerintah demi kebaikan negara!  Jambi  #BantuanBBMUntukRakyat #BLTBBMTepatSasaran #SubsidiTepatSasaran https://t.co/393QZ9020o,let's support the adjustment of fuel prices by the government for the good of Jambi,let's support adjustment fuel price government good Jambi,0.7,positive
3136,Pemerintah akan pastikan jaga perekonomian di tengah penyesuaian harga BBM  Jambi  #BantuanBBMUntukRakyat #BLTBBMTepatSasaran #SubsidiTepatSasaran https://t.co/oilkZbYmi7,the government will make sure to keep the economy in the midst of adjusting the price of Jambi fuel oil,government make sure keep economy midst adjusting price Jambi fuel oil,0.5,positive
3137,Pemerintah melakukan penyesuaian harga BBM agar stabilitas ekonomi Indonesia tetap terjaga dan penggunaan subsidi lebih tepat sasaran  Dukung penyesuaian harga BBM #BantuanBBMUntukRakyat #BLTBBMTepatSasaran #SubsidiTepatSasaran -Sumatera Utara- https://t.co/ZDejaATU62,The government is making adjustments to the price of fuel oil so that Indonesia's economic stability is maintained and the use of subsidies is more targeted to support the adjustment of the price of fuel oil in North Sumatra,The government making adjustment price fuel oil Indonesia's economic stability maintained use subsidy targeted support adjustment price fuel oil North Sumatra,0.2,positive
3138,Penyesuaian harga BBM harus diambil pemerintah agar menahan inflasi yang dampak biayanya jauh lebih besar  #BantuanBBMUntukRakyat #BLTBBMTepatSasaran #SubsidiTepatSasaran  Bali https://t.co/gDMB4fZ3T6,"the government must make adjustments to the price of fuel oil in order to restrain inflation, which will have a far greater cost to Bali","government must make adjustment price fuel oil order restrain inflation, far greater cost Bali",0.3,positive
3139,Kebijakan pemerintah melakukan penyesuaian harga BBM berikan dampak positif pada stabilitas ekonomi Indonesia  Dukung penyesuaian harga BBM #BantuanBBMUntukRakyat #BLTBBMTepatSasaran #SubsidiTepatSasaran -Sumatera Utara- https://t.co/vqbFI6ulKx,"the government's policy of adjusting fuel prices has had a positive impact on Indonesia's economic stability, supporting fuel price adjustments in North Sumatra","government's policy adjusting fuel price positive impact Indonesia's economic stability, supporting fuel price adjustment North Sumatra",0.22575757575757574,positive
3140,Pemerintah melakukan penyesuaian harga BBM demi menjaga stabilitas ekonomi Indonesia  Dukung penyesuaian harga BBM #BantuanBBMUntukRakyat #BLTBBMTepatSasaran #SubsidiTepatSasaran -Sumatera Utara- https://t.co/0LLlZvxeFy,The government has made adjustments to fuel prices in order to maintain Indonesia's economic stability. Supports adjustments to fuel prices for North Sumatra,The government made adjustment fuel price order maintain Indonesia's economic stability. Supports adjustment fuel price North Sumatra,0.2,positive
3141,Kebijakan pemerintah mengalihkan subsidi BBM ke sektor yang lebih urgen sangat tepat agar penggunaan subsidi jadi lebih tepat sasaran  Dukung penyesuaian harga BBM #BantuanBBMUntukRakyat #BLTBBMTepatSasaran #SubsidiTepatSasaran -Sumatera Utara- https://t.co/LtJYZP8DLx,the government's policy of diverting fuel subsidies to sectors that are more urgent is very appropriate so that the use of subsidies is more targeted to support the adjustment of fuel prices in North Sumatra,government's policy diverting fuel subsidy sector urgent appropriate use subsidy targeted support adjustment fuel price North Sumatra,0.5,positive
3142,"Masyarakat berpikir beralih kepada penyedia BBM swasta, dibandingkan pertamina. Masyarakat kasihan pada pemerintah harus menanggung subsidi begitu besarnya. Dengan membeli BBM dr swasta, subsidi tidak lagi diperlukan.",people think switching to private fuel oil providers compared to Pertamina people feel sorry for the government having to bear such large subsidies by buying fuel oil from private subsidies are no longer needed,people think switching private fuel oil provider compared Pertamina people feel sorry government bear large subsidy buying fuel oil private subsidy longer needed,-0.07142857142857142,negative
3143,Kebijakan pemerintah melakukan penyesuaian harga BBM sudah tepat dalam menjaga stabilitas ekonomi Indonesia  Dukung penyesuaian harga BBM #BantuanBBMUntukRakyat #BLTBBMTepatSasaran #SubsidiTepatSasaran -Sumatera Utara- https://t.co/1UMddC6JvQ,"The government's policy of adjusting the price of fuel oil is appropriate in maintaining Indonesia's economic stability, supporting the adjustment of fuel prices in North Sumatra","The government's policy adjusting price fuel oil appropriate maintaining Indonesia's economic stability, supporting adjustment fuel price North Sumatra",0.31666666666666665,positive
3144,Kebijakan pemerintah mengalihkan subsidi BBM ke bantuan sosial jadi komitmen pemerintah untuk wujudkan penggunaan subsidi yang tepat sasaran  Dukung penyesuaian harga BBM #BantuanBBMUntukRakyat #BLTBBMTepatSasaran #SubsidiTepatSasaran -Sumatera Utara- https://t.co/bef4AxPoLV,"the government's policy of diverting fuel subsidies to social assistance is the government's commitment to realize the use of subsidies that are on target, support the adjustment of fuel prices in North Sumatra","government's policy diverting fuel subsidy social assistance government's commitment realize use subsidy target, support adjustment fuel price North Sumatra",0.03333333333333333,positive
3145,Penyesuaian harga BBM jadi komitmen pemerintah wujudkan penggunaan subsidi yang tepat sasaran  Dukung penyesuaian harga BBM #BantuanBBMUntukRakyat #BLTBBMTepatSasaran #SubsidiTepatSasaran -Sumatera Utara- https://t.co/8snBfgEUX0,The adjustment in the price of fuel oil is the government's commitment to realize the use of subsidies that are right on target to support the adjustment in the price of fuel oil in North Sumatra,The adjustment price fuel oil government's commitment realize use subsidy right target support adjustment price fuel oil North Sumatra,0.2857142857142857,positive
3146,Kebijakan pemerintah melakukan penyesuaian harga BBM demi menjaga stabilitas ekonomi Indonesia  Dukung penyesuaian harga BBM #BantuanBBMUntukRakyat #BLTBBMTepatSasaran #SubsidiTepatSasaran -Sumatera Utara- https://t.co/DlcrvpS6l5,the government's policy of adjusting fuel prices in order to maintain Indonesia's economic stability supports the adjustment of fuel prices in North Sumatra,government's policy adjusting fuel price order maintain Indonesia's economic stability support adjustment fuel price North Sumatra,0.2,positive
3153,Pengalihan subsidi BBM  ke bansos merupakan upaya Pemerintah memberikan pemerataan subsidi bagi seluruh rakyat Indonesia.. Kami seluruh masyarakat Sumatera Utara mendukung penuh kebijakan Pemerintah..  #BantuanBBMUntukRakyat #BLTBBMTepatSasaran #SubsidiTepatSasaran https://t.co/aHG27a81ro,"The transfer of fuel subsidies to social assistance is the government's effort to provide equal distribution of subsidies for all Indonesian people. We, the entire people of North Sumatra, fully support government policies.","The transfer fuel subsidy social assistance government's effort provide equal distribution subsidy Indonesian people. We, entire people North Sumatra, fully support government policies.",0.011111111111111112,positive
3174,"Pak @ganjarpranowo , nuwunsewu Niki Kulo ngonangi mobil dinas jenis Innova ngisi BBM jenis Pertalite Ten SPBU Sirandu - Pemalang. Dinten Jumat 30 September 2022 pukul 06.42 wib. Jelas tidak sesuai dengan bijak Pemerintah. https://t.co/13ybsNFBEh",Mr. Nuwunsewu Niki Kulo Ngonangi official car type Innova refueling oil type Pertalite ten Sirandu Gas Station Pemalang Dinten Friday September at WIT is clearly not in accordance with the government's wisdom,Mr. Nuwunsewu Niki Kulo Ngonangi official car type Innova refueling oil type Pertalite ten Sirandu Gas Station Pemalang Dinten Friday September WIT clearly accordance government's wisdom,0.05000000000000001,positive
3176,"Terima kasih ASN Pemerintah Kota Magelang yg sudah #jumatbersepeda jaga udara kota. Cegah bencana iklim dg bersepeda, moda transportasi ramah lingkungan sekaligus ikuti anjuran walikota magelang  utk bersepeda kurangi ketergantungan BBM fosil. #ASNberanibersepeda #ASNbersepeda. https://t.co/vbbgHyvVJE",thank you asn magelang city government for guarding the city's air preventing climate disaster by cycling an environmentally friendly mode of transportation while at the same time following the recommendations of the mayor of Magelang to cycle to reduce dependence on fossil fuels,thank asn magelang city government guarding city's air preventing climate disaster cycling environmentally friendly mode transportation time following recommendation mayor Magelang cycle reduce dependence fossil fuel,0.1875,positive
3179,"""Begitu sulitnya antara mau paham atau bingung, mengingat banyak kontradiksi sana sini. Tapi alangkah baiknya kita mencoba memahami, meskipun itu membingungkan"" (Muhimmah)   #esai #pemerintah #begitusyulit #bbm #GhibahinId  https://t.co/PmAQ3J2UBv",it is so difficult between wanting to understand or being confused considering there are many contradictions here and there but it would be nice for us to try to understand even though it is confusing muhimmah,difficult wanting understand confused considering many contradiction would nice u try understand even though confusing muhimmah,-0.020000000000000007,negative
3180,"Andai Vivo diperkenankan jual Revvo89 dg harga tetap 8.900/liter, pemerintah gk usah lagi teriak2 glontorin subsidi 502T. Dg sndirinya subsidi utk Pertalite akan berkurang signifikan.   Fix ya. Kebijakan naikin harga BBM adalh subsidi rakyat utk nolong Pertamina dr kebangkrutan.","If Vivo were allowed to sell Revvo at a fixed price in liters, the government would no longer need to shout glontorin, subsidies by themselves subsidies for Pertalite would be significantly reduced, fix it. The policy to increase the price of fuel oil is a people's subsidy to help Pertamina from bankruptcy","If Vivo allowed sell Revvo fixed price liters, government would longer need shout glontorin, subsidy subsidy Pertalite would significantly reduced, fix it. The policy increase price fuel oil people's subsidy help Pertamina bankruptcy",0.2375,positive
